"Subject","Group","Condition","VideoTrial","VideoName","Target","Path","Manner","P_anyw","P_V","P_adj","M_anyw","M_V","M_adj"
"NS_175","NS","Control",24,"prd_balcol","Popi hace descender una pelota plástico de una montaña","V","No Manner",1,1,0,0,0,0
"NS_175","NS","Control",25,"pgt_panrue","Popi cruza una calle empujando una caja con manzanas","V","Adjunct",1,1,0,1,0,1
"NS_175","NS","Control",26,"tgd_malnei","Popi desciende una montaña nevada con un baúl a sus espaldas arrastrándolo","V","Adjunct",1,1,0,1,0,1
"NS_175","NS","Control",27,"prt_rourou","Popi cruza un río haciendo girar una rueda","V","Adjunct",1,1,0,1,0,1
"NS_175","NS","Control",28,"pgm_paqtoi","Popi sube hasta lo alto de un tejado arrastrando un paquete envuelto en papel de regalo","V+Adjunct","Adjunct",1,1,1,1,0,1
"NS_175","NS","Control",29,"trd_bronei","Popi desciende una colina nevada arrastrando un carretón","V","Adjunct",1,1,0,1,0,1
"NS_175","NS","Control",30,"tge_chamai","Popi introduce una silla verde en un granero","V","No Manner",1,1,0,0,0,0
"NS_175","NS","Control",31,"prt_rourue","Popi cruza una calle mientras hace girar una rueda","V","Adjunct",1,1,0,1,0,1
"NS_175","NS","Control",32,"pge_tabmai","Popi entra en un granero arrastrando una mesa de madera","V","Adjunct",1,1,0,1,0,1
"NS_176","NS","Path",1,"pgt_panrue","Popi cruza una calle con un cesto de fruta","V","No Manner",1,1,0,0,0,0
"NS_176","NS","Path",2,"trm_voitoi","Popi sube por un tejado con cochecito","V","No Manner",1,1,0,0,0,0
"NS_176","NS","Path",3,"tge_chamai","Popi entra en un sitio tirando de una silla","V","Adjunct",1,1,0,1,0,1
"NS_176","NS","Path",4,"trd_brocol","Popi baja una cuesta de una montaña con un carro","V","No Manner",1,1,0,0,0,0
"NS_176","NS","Path",5,"pgm_paqtoi","Popi sube un tejarito empujando un regalo","V","Adjunct",1,1,0,1,0,1
"NS_176","NS","Path",6,"pre_pnegro","Popi entra en una cueva con una rueda","V","No Manner",1,1,0,0,0,0
"NS_176","NS","Path",7,"pgd_valnei","Popi baja un pendiente con una maleta","V","No Manner",1,1,0,0,0,0
"NS_176","NS","Path",8,"pre_pnemai","Popi entra en un sitio con un aro","V","No Manner",1,1,0,0,0,0
"NS_176","NS","Path",9,"tgt_cherou","Popi cruza una calle tirando de un caballito","V","Adjunct",1,1,0,1,0,1
"NS_176","NS","Path",10,"pgm_paqdun","Popi sube una cuesta empujando un regalo","V","Adjunct",1,1,0,1,0,1
"NS_176","NS","Path",11,"trt_pourou","Popi cruza una calle tirando de un carrito","V","Adjunct",1,1,0,1,0,1
"NS_176","NS","Path",12,"pge_tabgro","Popi entra en una cueva con una mesa","V","No Manner",1,1,0,0,0,0
"NS_176","NS","Path",13,"tgm_sacdun","Popi sube una cuesta tirando de un saco","V","Adjunct",1,1,0,1,0,1
"NS_176","NS","Path",14,"pgt_panrou","Popi cruza una calle empujando un cesto de fruta","V","Adjunct",1,1,0,1,0,1
"NS_176","NS","Path",15,"trm_voidun","Popi sube una cuesta tirando de un cochecito de niño","V","Adjunct",1,1,0,1,0,1
"NS_176","NS","Path",16,"prd_balcol","Popi baja una cuesta con una pelota","V","No Manner",1,1,0,0,0,0
"NS_176","NS","Path",17,"tgt_cherue","Popi cruza la calle con un caballito","V","No Manner",1,1,0,0,0,0
"NS_176","NS","Path",18,"tre_cadmai","Popi entra en un sitio con un carrito","V","No Manner",1,1,0,0,0,0
"NS_176","NS","Path",19,"prm_boutoi","Popi sube un tejado con un flotador","V","No Manner",1,1,0,0,0,0
"NS_176","NS","Path",20,"tgd_malcol","Popi baja una cuesta con un cofre","V","No Manner",1,1,0,0,0,0
"NS_176","NS","Path",21,"trt_pourue","Popi cruza la calle con un carrito de bebé","V","No Manner",1,1,0,0,0,0
"NS_176","NS","Path",22,"tgm_sactoi","Popi sube un tejado tirando de un saco","V","Adjunct",1,1,0,1,0,1
"NS_176","NS","Path",23,"pge_tabmai","Popi entra en una habitación empujando una mesa","V","Adjunct",1,1,0,1,0,1
"NS_176","NS","Path",24,"trd_bronei","Popi baja una cuesta con una carretilla","V","No Manner",1,1,0,0,0,0
"NS_176","NS","Path",25,"prm_boudun","Popi sube una cuesta con un flotador","V","No Manner",1,1,0,0,0,0
"NS_176","NS","Path",26,"tge_chagro","Popi entra en una cueva tirando de una silla","V","Adjunct",1,1,0,1,0,1
"NS_176","NS","Path",27,"prd_balnei","Popi baja una cuesta con una pelota","V","No Manner",1,1,0,0,0,0
"NS_176","NS","Path",28,"tre_cadgro","Popi entra en una cueva con un carrito","V","No Manner",1,1,0,0,0,0
"NS_176","NS","Path",29,"pgd_valcol","Popi baja una cuesta con una maleta","V","No Manner",1,1,0,0,0,0
"NS_176","NS","Path",30,"prt_rourou","Popi cruza la calle con una rueda","V","No Manner",1,1,0,0,0,0
"NS_176","NS","Path",31,"tgd_malnei","Popi baja la cuesta con un cofre","V","No Manner",1,1,0,0,0,0
"NS_176","NS","Path",32,"pre_pnegro","Popi entra en una cueva con una rueda","V","No Manner",1,1,0,0,0,0
"NS_177","NS","Control",1,"pgm_paqtoi","Popi ha arrastrado una caja de algo sobre un tejado","No Path","V",0,0,0,1,1,0
"NS_177","NS","Control",2,"tre_cadmai","Popi viene arrastrando un carrito de la compra y entra por una puerta roja","V","Adjunct",1,1,0,1,0,1
"NS_177","NS","Control",3,"pgd_valcol","Popi baja una maleta por la ladera de la montaña","V","No Manner",1,1,0,0,0,0
"NS_177","NS","Control",4,"prt_rourou","Popi hace girar una rueda atravesando un camino","Adjunct","V",1,0,1,1,1,0
"NS_177","NS","Control",5,"pge_tabmai","Popi arrastra una mesa de madera hasta llegar a una casa y meterla por la puerta","Adjunct","V",1,0,1,1,1,0
"NS_177","NS","Control",6,"tgm_sacdun","Popi sube un saco por una playa","V","No Manner",1,1,0,0,0,0
"NS_177","NS","Control",7,"prt_rourue","Popi hace girar una rueda a través de un camino","Adjunct","V",1,0,1,1,1,0
"NS_177","NS","Control",8,"tgd_malnei","Popi arrastra un baúl por la ladera de una montaña nevada","No Path","V",0,0,0,1,1,0
"NS_177","NS","Control",9,"trm_voidun","Popi hace subir un coche de juguete tamaño persona por la misma playa de antes","V","No Manner",1,1,0,0,0,0
"NS_177","NS","Control",10,"pgt_panrue","Popi empuja una gran cesta de madera llena de manzanas por el camino","No Path","V",0,0,0,1,1,0
"NS_177","NS","Control",11,"prm_boutoi","Popi hace girar un flotador naranja con delfines por el tejado","No Path","V",0,0,0,1,1,0
"NS_177","NS","Control",12,"pgt_panrou","Popi arrastra la cesta de madera con manzanas a través de un camino","Adjunct","V",1,0,1,1,1,0
"NS_177","NS","Control",13,"prd_balnei","Popi baja una gran bola de playa por la ladera de una montaña nevada","V","No Manner",1,1,0,0,0,0
"NS_177","NS","Control",14,"trm_voitoi","Popi sube un coche de juguete por el tejado de la casa","V","No Manner",1,1,0,0,0,0
"NS_177","NS","Control",15,"tge_chagro","Popi lleva una silla de plástico y la mete en una cueva","V","No Manner",1,1,0,0,0,0
"NS_177","NS","Control",16,"trt_pourou","Popi arrastra un carrito de bebés a través de un camino","Adjunct","V",1,0,1,1,1,0
"NS_177","NS","Control",17,"prm_boudun","Popi arrastra un flotador naranja con delfines por la costa de una playa","No Path","V",0,0,0,1,1,0
"NS_177","NS","Control",18,"tge_chamai","Popi arrastra a sus espaldas una silla verde de plástico y la mete en una casa con la puerta roja","V","V+Adjunct",1,1,0,1,1,1
"NS_177","NS","Control",19,"pgd_valnei","Popi baja una maleta por la ladera de la montaña nevada","V","No Manner",1,1,0,0,0,0
"NS_177","NS","Control",20,"tgm_sactoi","Popi arrastra un saco hasta la cima del tejado","Adjunct","V",1,0,1,1,1,0
"NS_177","NS","Control",21,"trd_brocol","Popi baja una carretilla naranja por la ladera de una colina","V","No Manner",1,1,0,0,0,0
"NS_177","NS","Control",22,"tgt_cherue","Popi arrastra un caballo de madera a través de una calle","Adjunct","V",1,0,1,1,1,0
"NS_177","NS","Control",23,"pgm_paqdun","Popi sube por la costa de la playa una caja de regalo envuelta","V","No Manner",1,1,0,0,0,0
"NS_177","NS","Control",24,"trd_bronei","Popi baja una carretilla naranja por la ladera de una montaña nevada","V","No Manner",1,1,0,0,0,0
"NS_177","NS","Control",25,"pre_pnegro","Popi arrastra una rueda negra por un camino en el bosque y la mete en una cueva","V","V",1,1,0,1,1,0
"NS_177","NS","Control",26,"trt_pourue","Popi arrastra un carrito de bebés a través de la calle","Adjunct","V",1,0,1,1,1,0
"NS_177","NS","Control",27,"prd_balcol","Popi baja una pelota de playa por la ladera de una colina","V","No Manner",1,1,0,0,0,0
"NS_177","NS","Control",28,"tgt_cherou","Popi arrastra un caballo de madera de juguete a través de un camino","Adjunct","V",1,0,1,1,1,0
"NS_177","NS","Control",29,"pre_pnemai","Popi arrastra una rueda y la mete en una casa con una puerta roja","V","V",1,1,0,1,1,0
"NS_177","NS","Control",30,"tgd_malcol","Popi baja un baúl por la ladera de una colina","V","No Manner",1,1,0,0,0,0
"NS_177","NS","Control",31,"pge_tabgro","Popi mete una mesa de madera en una cueva","V","No Manner",1,1,0,0,0,0
"NS_177","NS","Control",32,"trd_bronei","Popi baja una carretilla naranja por la ladera de una colina nevada","V","No Manner",1,1,0,0,0,0
"NS_178","NS","Manner",1,"pgm_paqtoi","Popi sube una cuesta","V","No Manner",1,1,0,0,0,0
"NS_178","NS","Manner",2,"tge_chagro","Popi arrastra una silla hacia la cueva","No Path","V",0,0,0,1,1,0
"NS_178","NS","Manner",3,"prd_balcol","Popi rueda una pelota y baja una cuesta","V","V",1,1,0,1,1,0
"NS_178","NS","Manner",4,"pgm_paqdun","Popi sube un regalo por una duna","V","No Manner",1,1,0,0,0,0
"NS_178","NS","Manner",5,"tge_chamai","Popi arrastra una silla hacia una casa","No Path","V",0,0,0,1,1,0
"NS_178","NS","Manner",6,"prm_boudun","Popi rueda un flotador por una duna de arena","No Path","V",0,0,0,1,1,0
"NS_178","NS","Manner",7,"pgd_valcol","Popi baja una maleta por una cuesta","V","No Manner",1,1,0,0,0,0
"NS_178","NS","Manner",8,"prt_rourou","Popi rueda una rueda y pasa un camino","No Path","V",0,0,0,1,1,0
"NS_178","NS","Manner",9,"trm_voidun","Popi sube un coche de juguete por una duna de arena","V","No Manner",1,1,0,0,0,0
"NS_178","NS","Manner",10,"pgt_panrou","Popi transporta una cesta con manzanas a través de un camino","Adjunct","No Manner",1,0,1,0,0,0
"NS_178","NS","Manner",11,"trm_voitoi","Popi sube un coche de juguete por el tejado de una casa","V","No Manner",1,1,0,0,0,0
"NS_178","NS","Manner",12,"tgd_malcol","Popi baja un baúl muy pesado por una cuesta","V","No Manner",1,1,0,0,0,0
"NS_178","NS","Manner",13,"prt_rourue","Popi rueda una rueda y pasa una calle","No Path","V",0,0,0,1,1,0
"NS_178","NS","Manner",14,"tre_cadmai","Popi vuelve a casa después de haber hecho una compra con un carro ","No Path","No Manner",0,0,0,0,0,0
"NS_178","NS","Manner",15,"tgt_cherue","Popi lleva de una acera a otra un caballito de juguete","Adjunct","No Manner",1,0,1,0,0,0
"NS_178","NS","Manner",16,"trd_brocol","Popi baja una herramienta de obra por una cuesta","V","No Manner",1,1,0,0,0,0
"NS_178","NS","Manner",17,"tgt_cherou","Popi lleva un caballo de juguete de un lado del camino a otro","Adjunct","No Manner",1,0,1,0,0,0
"NS_178","NS","Manner",18,"tre_cadgro","Popi entra en una cueva con un carro de la compra","V","No Manner",1,1,0,0,0,0
"NS_178","NS","Manner",19,"tgd_malnei","Popi baja un baúl por una montaña de nieve","V","No Manner",1,1,0,0,0,0
"NS_178","NS","Manner",20,"pgt_panrue","Popi lleva una cesta grande de manzanas de un lado de la acera a otro","Adjunct","No Manner",1,0,1,0,0,0
"NS_178","NS","Manner",21,"prm_boutoi","Popi sube rodando un flotador por el techo de una casa","V","Adjunct",1,1,0,1,0,1
"NS_178","NS","Manner",22,"pge_tabmai","Popi arrastra una mesa al interior de una casa","Adjunct","V",1,0,1,1,1,0
"NS_178","NS","Manner",23,"trt_pourou","Popi lleva un carro de bebé de un lado al otro del camino","Adjunct","No Manner",1,0,1,0,0,0
"NS_178","NS","Manner",24,"pge_tabgro","Popi arrastra una mesa al interior de una cueva","Adjunct","V",1,0,1,1,1,0
"NS_178","NS","Manner",25,"trt_pourue","Popi lleva un carro de bebé de un lado al otro del camino","Adjunct","No Manner",1,0,1,0,0,0
"NS_178","NS","Manner",26,"tgm_sacdun","Popi arrastra un saco y sube una duna de arena","V","V",1,1,0,1,1,0
"NS_178","NS","Manner",27,"trd_bronei","Popi baja una carretilla de una montaña de nieve","V","No Manner",1,1,0,0,0,0
"NS_178","NS","Manner",28,"tgm_sactoi","Popi arrastra un saco y sube por un tejado inclinado de una casa","V","V",1,1,0,1,1,0
"NS_178","NS","Manner",29,"pre_pnemai","Popi lleva una rueda a su casa","No Path","No Manner",0,0,0,0,0,0
"NS_178","NS","Manner",30,"pgd_valnei","Popi baja una maleta de una montaña de nieve","V","No Manner",1,1,0,0,0,0
"NS_178","NS","Manner",31,"pre_pnegro","Popi lleva una rueda al interior de una cueva","Adjunct","No Manner",1,0,1,0,0,0
"NS_178","NS","Manner",32,"pgd_valnei","Popi baja una maleta en una montaña de arena","V","No Manner",1,1,0,0,0,0
"NS_179","NS","Manner",1,"pgm_paqtoi","Popi está subiendo al tejado un paquete del regalo","V","No Manner",1,1,0,0,0,0
"NS_179","NS","Manner",2,"tgd_malnei","Popi baja la montaña de nieve un cofre","V","No Manner",1,1,0,0,0,0
"NS_179","NS","Manner",3,"trt_pourou","Popi cruza la calle junta con el carrito","V","No Manner",1,1,0,0,0,0
"NS_179","NS","Manner",4,"prm_boudun","Popi sube la montaña con su flotador","V","No Manner",1,1,0,0,0,0
"NS_179","NS","Manner",5,"pgd_valnei","Popi baja la pendiente una maleta","V","No Manner",1,1,0,0,0,0
"NS_179","NS","Manner",6,"prm_boutoi","Popi sube al tejado su flotador","V","No Manner",1,1,0,0,0,0
"NS_179","NS","Manner",7,"tgt_cherue","Popi cruza la calle de ese pueblo junto con su caballito de madera","V","No Manner",1,1,0,0,0,0
"NS_179","NS","Manner",8,"trm_voidun","Popi sube junto con su coche","V","No Manner",1,1,0,0,0,0
"NS_179","NS","Manner",9,"tge_chamai","Popi guarda su silla en una granja","No Path","No Manner",0,0,0,0,0,0
"NS_179","NS","Manner",10,"pgd_valcol","en el bosque Popi baja la pendiente junto con su maleta","V","No Manner",1,1,0,0,0,0
"NS_179","NS","Manner",11,"prt_rourue","en el pueblo Popi cruza la calle con una rueda","V","No Manner",1,1,0,0,0,0
"NS_179","NS","Manner",12,"pge_tabmai","Popi guarda la mesa en la granja","No Path","No Manner",0,0,0,0,0,0
"NS_179","NS","Manner",13,"prd_balcol","Popi baja la pendiente del bosque junto con una pelota hinchable","V","No Manner",1,1,0,0,0,0
"NS_179","NS","Manner",14,"pgt_panrue","en el pueblo Popi cruza la calle empujando una cesta de frutas","V","Adjunct",1,1,0,1,0,1
"NS_179","NS","Manner",15,"pre_pnegro","Popi mete en la cueva una rueda","V","No Manner",1,1,0,0,0,0
"NS_179","NS","Manner",16,"pgt_panrou","Popi empuja la cesta de frutas hacia el otro lado de la calle","Adjunct","V",1,0,1,1,1,0
"NS_179","NS","Manner",17,"tgd_malcol","Popi baja la pendiente del bosque junto con un cofre","V","No Manner",1,1,0,0,0,0
"NS_179","NS","Manner",18,"pge_tabgro","Popi arrastra una mesa hacia la cueva","No Path","V",0,0,0,1,1,0
"NS_179","NS","Manner",19,"tgm_sacdun","Popi sube una pendiente de arena un saco","V","No Manner",1,1,0,0,0,0
"NS_179","NS","Manner",20,"prt_rourou","Popi traslada una rueda de un lado a otro","Adjunct","No Manner",1,0,1,0,0,0
"NS_179","NS","Manner",21,"tre_cadmai","Popi guarda el carrito de la compra en la xxx","No Path","No Manner",0,0,0,0,0,0
"NS_179","NS","Manner",22,"pgm_paqdun","Popi sube la pendiente de arena con un regalo","V","No Manner",1,1,0,0,0,0
"NS_179","NS","Manner",23,"trd_brocol","Popi baja la pendiente del bosque arrastrando una carrilla","V","Adjunct",1,1,0,1,0,1
"NS_179","NS","Manner",24,"tgt_cherou","Popi cruza la calle junto con su caballito de madera","V","No Manner",1,1,0,0,0,0
"NS_179","NS","Manner",25,"tre_cadgro","Popi lleva el carrito de compra a la cueva","No Path","No Manner",0,0,0,0,0,0
"NS_179","NS","Manner",26,"tgm_sactoi","Popi sube el tejado arrastrando un saco","V","Adjunct",1,1,0,1,0,1
"NS_179","NS","Manner",27,"trt_pourue","Popi cruza la calle del pueblo junto con un carrito","V","No Manner",1,1,0,0,0,0
"NS_179","NS","Manner",28,"prd_balnei","Popi baja la pendiente de nieve rodando una pelota","V","Adjunct",1,1,0,1,0,1
"NS_179","NS","Manner",29,"trm_voitoi","Popi sube el tejado su coche","V","No Manner",1,1,0,0,0,0
"NS_179","NS","Manner",30,"tge_chagro","Popi arrastra la silla hacia la cueva","No Path","V",0,0,0,1,1,0
"NS_179","NS","Manner",31,"trd_bronei","Popi baja la carretilla por la pendiente de nieve","V","No Manner",1,1,0,0,0,0
"NS_179","NS","Manner",32,"pre_pnegro","Popi lleva la rueda hacia la cueva","No Path","No Manner",0,0,0,0,0,0
"NS_180","NS","Path",1,"pge_tabmai","Popi arrastra una mesa dentro de una casa","Adjunct","V",1,0,1,1,1,0
"NS_180","NS","Path",2,"tgm_sacdun","Popi sube un saco arriba de una duna","V+Adjunct","No Manner",1,1,1,0,0,0
"NS_180","NS","Path",3,"trt_pourue","Popi cruza la calle con un carrito de bebé","V","No Manner",1,1,0,0,0,0
"NS_180","NS","Path",4,"prm_boutoi","Popi sube al tejado de una casa con un flotador","V","No Manner",1,1,0,0,0,0
"NS_180","NS","Path",5,"tge_chamai","Popi mete una silla dentro de una casa","V+Adjunct","No Manner",1,1,1,0,0,0
"NS_180","NS","Path",6,"pgm_paqtoi","Popi empuja un regalo encima de un tejado","No Path","V",0,0,0,1,1,0
"NS_180","NS","Path",7,"pre_pnemai","Popi mete una rueda dentro de la casa","V+Adjunct","No Manner",1,1,1,0,0,0
"NS_180","NS","Path",8,"tgd_malcol","Popi lleva hacia abajo un arcón","Adjunct","No Manner",1,0,1,0,0,0
"NS_180","NS","Path",9,"tre_cadmai","Popi lleva a casa después de hacer la compra","No Path","No Manner",0,0,0,0,0,0
"NS_180","NS","Path",10,"tgt_cherue","Popi arrastra un caballito de juguete","No Path","V",0,0,0,1,1,0
"NS_180","NS","Path",11,"prd_balnei","Popi juega con una pelota en la nieve","No Path","No Manner",0,0,0,0,0,0
"NS_180","NS","Path",12,"tre_cadgro","Popi entra en una cueva con un carrito de la compra","V","No Manner",1,1,0,0,0,0
"NS_180","NS","Path",13,"tgt_cherou","Popi lleva un caballito de juguete","No Path","No Manner",0,0,0,0,0,0
"NS_180","NS","Path",14,"pge_tabgro","Popi lleva a una cueva una mesa","No Path","No Manner",0,0,0,0,0,0
"NS_180","NS","Path",15,"prt_rourou","Popi cruza la carretera con una rueda","V","No Manner",1,1,0,0,0,0
"NS_180","NS","Path",16,"tgm_sactoi","Popi lleva un saco hasta arriba del tejado","Adjunct","No Manner",1,0,1,0,0,0
"NS_180","NS","Path",17,"pre_pnegro","Popi lleva una rueda dentro de la cueva","Adjunct","No Manner",1,0,1,0,0,0
"NS_180","NS","Path",18,"pgt_panrue","Popi lleva una cesta llena de manzanas","No Path","No Manner",0,0,0,0,0,0
"NS_180","NS","Path",19,"tgd_malnei","Popi bajó un montículo arrastrando un arcón","V","Adjunct",1,1,0,1,0,1
"NS_180","NS","Path",20,"pgm_paqdun","Popi empuja un regalo encima de la duna","No Path","V",0,0,0,1,1,0
"NS_180","NS","Path",21,"trd_brocol","Popi baja un montículo con una carretilla","V","No Manner",1,1,0,0,0,0
"NS_180","NS","Path",22,"pgt_panrou","Popi empuja una cesta de fruta","No Path","V",0,0,0,1,1,0
"NS_180","NS","Path",23,"tge_chagro","Popi lleva una silla adentro de la cueva","Adjunct","No Manner",1,0,1,0,0,0
"NS_180","NS","Path",24,"trt_pourou","Popi sale de paseo con su hijo en un coche de bebé","No Path","No Manner",0,0,0,0,0,0
"NS_180","NS","Path",25,"pgd_valnei","Popi sale de viaje con una maleta","No Path","No Manner",0,0,0,0,0,0
"NS_180","NS","Path",26,"trm_voitoi","Popi juega con su coche de juguete","No Path","No Manner",0,0,0,0,0,0
"NS_180","NS","Path",27,"prd_balcol","Popi juega con su pelota ladera abajo","Adjunct","No Manner",1,0,1,0,0,0
"NS_180","NS","Path",28,"trm_voidun","Popi se va a casa después de jugar con su coche","No Path","No Manner",0,0,0,0,0,0
"NS_180","NS","Path",29,"prt_rourue","Popi cruza la carretera con una rueda","V","No Manner",1,1,0,0,0,0
"NS_180","NS","Path",30,"trd_bronei","Popi vuelve a casa tras recoger leña","No Path","No Manner",0,0,0,0,0,0
"NS_180","NS","Path",31,"prm_boudun","Popi juega en la arena con un aro","No Path","No Manner",0,0,0,0,0,0
"NS_180","NS","Path",32,"pgd_valcol","Popi baja una cuesta con una maleta","V","No Manner",1,1,0,0,0,0
"NS_181","NS","Path",1,"pge_tabgro","Popi arrastra una mesa en el bosque","No Path","V",0,0,0,1,1,0
"NS_181","NS","Path",2,"tgt_cherou","Popi cruza un río con un caballo","V","No Manner",1,1,0,0,0,0
"NS_181","NS","Path",4,"trd_brocol","Popi baja una carretilla por una montaña","V","No Manner",1,1,0,0,0,0
"NS_181","NS","Path",5,"tgt_cherue","Popi cruza una calle con un caballito","V","No Manner",1,1,0,0,0,0
"NS_181","NS","Path",6,"trm_voidun","Popi sube por la arena con un coche","V","No Manner",1,1,0,0,0,0
"NS_181","NS","Path",7,"prt_rourue","Popi cruza una calle con una rueda","V","No Manner",1,1,0,0,0,0
"NS_181","NS","Path",8,"pgd_valnei","Popi baja por la nieve con una maleta","V","No Manner",1,1,0,0,0,0
"NS_181","NS","Path",9,"tgm_sacdun","Popi sube un saco por la arena","V","No Manner",1,1,0,0,0,0
"NS_181","NS","Path",10,"pre_pnegro","Popi arrastra una rueda hacia una cueva","No Path","V",0,0,0,1,1,0
"NS_181","NS","Path",11,"trm_voitoi","Popi sube con un cochecito por un tejado","V","No Manner",1,1,0,0,0,0
"NS_181","NS","Path",12,"tgd_malcol","Popi baja un cofre por un montículo","V","No Manner",1,1,0,0,0,0
"NS_181","NS","Path",13,"tre_cadmai","Popi entra en una granja con un carrito","V","No Manner",1,1,0,0,0,0
"NS_181","NS","Path",14,"prm_boudun","Popi sube un flotador por un montículo","V","No Manner",1,1,0,0,0,0
"NS_181","NS","Path",15,"pge_tabmai","Popi entra en una granja con una mesa","V","No Manner",1,1,0,0,0,0
"NS_181","NS","Path",16,"prd_balnei","Popi baja por la nieve con una pelota","V","No Manner",1,1,0,0,0,0
"NS_181","NS","Path",17,"tgm_sactoi","Popi sube por un tejado con un saco","V","No Manner",1,1,0,0,0,0
"NS_181","NS","Path",18,"tre_cadgro","Popi entra en una cueva con un carrito","V","No Manner",1,1,0,0,0,0
"NS_181","NS","Path",19,"pgm_paqtoi","Popi sube un tejado con un regalo","V","No Manner",1,1,0,0,0,0
"NS_181","NS","Path",20,"tge_chamai","Popi entra en una casa con una silla","V","No Manner",1,1,0,0,0,0
"NS_181","NS","Path",21,"pgd_valcol","Popi baja un montículo con una maleta","V","No Manner",1,1,0,0,0,0
"NS_181","NS","Path",22,"trt_pourue","Popi cruza una calle con un carrito de bebé","V","No Manner",1,1,0,0,0,0
"NS_181","NS","Path",23,"prd_balcol","Popi baja un montículo con una pelota","V","No Manner",1,1,0,0,0,0
"NS_181","NS","Path",24,"pgt_panrue","Popi cruza una calle con una cesta de fruta","V","No Manner",1,1,0,0,0,0
"NS_181","NS","Path",25,"pre_pnemai","Popi entra en un local con una rueda","V","No Manner",1,1,0,0,0,0
"NS_181","NS","Path",26,"pgm_paqdun","Popi sube un montículo con un regalo","V","No Manner",1,1,0,0,0,0
"NS_181","NS","Path",27,"prt_rourou","Popi cruza un río con una llanta","V","No Manner",1,1,0,0,0,0
"NS_181","NS","Path",28,"tge_chagro","Popi entra en una cueva con una silla","V","No Manner",1,1,0,0,0,0
"NS_181","NS","Path",29,"pgt_panrou","Popi cruza un río con una cesta de frutas","V","No Manner",1,1,0,0,0,0
"NS_181","NS","Path",30,"tgd_malnei","Popi baja por la nieve con un cofre","V","No Manner",1,1,0,0,0,0
"NS_181","NS","Path",31,"trt_pourou","Popi cruza un río con un carrito de bebé","V","No Manner",1,1,0,0,0,0
"NS_181","NS","Path",32,"prm_boutoi","Popi sube por un tejado con un flotador","V","No Manner",1,1,0,0,0,0
"NS_182","NS","Manner",1,"trt_pourou","Popa tira de un carrito por la calle","No Path","V",0,0,0,1,1,0
"NS_182","NS","Manner",2,"tgd_malnei","Popi arrastra un baúl por la nieve","No Path","V",0,0,0,1,1,0
"NS_182","NS","Manner",3,"prm_boudun","Popi rueda un flotador por la playa","No Path","V",0,0,0,1,1,0
"NS_182","NS","Manner",4,"pgt_panrue","Popi empuja una cesta de manzanas por la calle","No Path","V",0,0,0,1,1,0
"NS_182","NS","Manner",5,"prm_boutoi","Popi rueda un flotador por el tejado de un caserío","No Path","V",0,0,0,1,1,0
"NS_182","NS","Manner",6,"pge_tabgro","Popi empuja una mesa hacia una cueva","No Path","V",0,0,0,1,1,0
"NS_182","NS","Manner",7,"trm_voidun","Popi tira de un cochecito por la playa","No Path","V",0,0,0,1,1,0
"NS_182","NS","Manner",8,"prt_rourou","Popi hace rodar una rueda por la calle","No Path","V",0,0,0,1,1,0
"NS_182","NS","Manner",9,"pge_tabmai","Popi mete empujando una mesa en una casa","V","Adjunct",1,1,0,1,0,1
"NS_182","NS","Manner",10,"prd_balcol","Popi empuja una pelota por una montaña","No Path","V",0,0,0,1,1,0
"NS_182","NS","Manner",11,"tgm_sacdun","Popi arrastra un saco por la playa","No Path","V",0,0,0,1,1,0
"NS_182","NS","Manner",12,"pgd_valnei","Popi empuja una maleta por la nieve","No Path","V",0,0,0,1,1,0
"NS_182","NS","Manner",13,"pre_pnegro","Popi rueda una rueda por el campo","No Path","V",0,0,0,1,1,0
"NS_182","NS","Manner",14,"tgt_cherou","Popi arrastra un caballito de madera por el parque","No Path","V",0,0,0,1,1,0
"NS_182","NS","Manner",15,"pgd_valcol","Popi empuja una maleta por una rampa","No Path","V",0,0,0,1,1,0
"NS_182","NS","Manner",16,"prt_rourue","Popi rueda una rueda por la calle","No Path","V",0,0,0,1,1,0
"NS_182","NS","Manner",17,"tgd_malcol","Popi arrastra un baúl por la montaña","No Path","V",0,0,0,1,1,0
"NS_182","NS","Manner",18,"trm_voitoi","Popi tira de un cochecito por el tejado de un caserío","No Path","V",0,0,0,1,1,0
"NS_182","NS","Manner",19,"tge_chagro","Popi tira de una silla por el bosque","No Path","V",0,0,0,1,1,0
"NS_182","NS","Manner",20,"pgt_panrou","Popi empuja una cesta de manzanas por el parque","No Path","V",0,0,0,1,1,0
"NS_182","NS","Manner",21,"tre_cadgro","Popi tira de un carro por el bosque","No Path","V",0,0,0,1,1,0
"NS_182","NS","Manner",22,"pgm_paqdun","Popi empuja un regalo por la playa","No Path","V",0,0,0,1,1,0
"NS_182","NS","Manner",23,"trd_bronei","Popi tira de una carretilla por la nieve","No Path","V",0,0,0,1,1,0
"NS_182","NS","Manner",24,"tge_chamai","Popi mete arrastrando una silla en una casa","V","Adjunct",1,1,0,1,0,1
"NS_182","NS","Manner",25,"prd_balnei","Popi rueda una pelota por la nieve","No Path","V",0,0,0,1,1,0
"NS_182","NS","Manner",26,"tgm_sactoi","Popi tira de un saco por el tejado de un castillo","No Path","V",0,0,0,1,1,0
"NS_182","NS","Manner",27,"trd_brocol","Popi tira de una carretilla por el prado","No Path","V",0,0,0,1,1,0
