"Subject","Group","Condition","VideoTrial","VideoName","Target","Path","Manner","P_anyw","P_V","P_adj","M_anyw","M_V","M_adj"
"59","L2","Control",18,"trd_brocol","Popi ha bajado por una colina llevando <un carrete amarillo> [=una carretilla amarilla]","V","No Manner",1,1,0,0,0,0
"59","L2","Control",19,"pge_tabmai","Popi ha entrado en un tipo de bodega con una mesa","V","No Manner",1,1,0,0,0,0
"59","L2","Control",20,"prt_rourue","Popi ha atravesado una calle con una rueda de carrete [=carreta] bastante grande","V","No Manner",1,1,0,0,0,0
"59","L2","Control",21,"pgm_paqtoi","Popi ha subido por el tejado de una casa con un paquete envuelto en papel","V","No Manner",1,1,0,0,0,0
"59","L2","Control",22,"trt_pourou","Popi ha cruzado una carretera con un coche de niño","V","No Manner",1,1,0,0,0,0
"59","L2","Control",23,"prd_balnei","Popi ha bajado por una colina cubierta de nieve con un gran balón hinchable","V","No Manner",1,1,0,0,0,0
"59","L2","Control",24,"tge_chamai","Popi ha entrado en un granjero [granero] o bodega con una silla plástica","V","No Manner",1,1,0,0,0,0
"59","L2","Control",25,"prm_boudun","Popi ha subido por una colina con un flotador plástico","V","No Manner",1,1,0,0,0,0
"59","L2","Control",26,"pge_tabgro","Popi ha entrado en una cueva con una mesa de madera","V","No Manner",1,1,0,0,0,0
"59","L2","Control",27,"tgm_sactoi","Popi ha subido por el tejado de una casa grande arrastrando un gran saco","V","Adjunct",1,1,0,1,0,1
"59","L2","Control",28,"pre_pnemai","Popi ha entrado en el granjero [=granero] con una gran llanta","V","No Manner",1,1,0,0,0,0
"59","L2","Control",29,"pgd_valnei","Popi ha bajado una maleta por una colina cubierta de nieve","V","No Manner",1,1,0,0,0,0
"59","L2","Control",30,"trm_voidun","Popi ha subido por una duna arrastrando un coche de juguete","V","Adjunct",1,1,0,1,0,1
"59","L2","Control",31,"tgt_cherue","Popi ha cruzado una calle con un caballo de juguete","V","No Manner",1,1,0,0,0,0
"59","L2","Control",32,"pre_pnemai","Popi ha entrado en una bodega con una gran rueda","V","No Manner",1,1,0,0,0,0
"60","L2","Manner",1,"tgt_cherou","Popi ha cruzado el camino con un juguete caballo","V","No Manner",1,1,0,0,0,0
"60","L2","Manner",2,"pgm_paqtoi","Popi ha transportado un paquete desde la césped hasta arriba de un tejado","Adjunct","No Manner",1,0,1,0,0,0
"60","L2","Manner",3,"pre_pnemai","ha entrado con la rueda en el garaje","V","No Manner",1,1,0,0,0,0
"60","L2","Manner",4,"tgm_sacdun","Popi ha subido una duna con un saco","V","No Manner",1,1,0,0,0,0
"60","L2","Manner",5,"pgd_valcol","Popi ha bajado una maleta por una colina","V","No Manner",1,1,0,0,0,0
"60","L2","Manner",6,"tgm_sactoi","Popi ha subido por el tejado con un saco","V","No Manner",1,1,0,0,0,0
"60","L2","Manner",7,"trd_brocol","Popi acaba de bajar una colina con una carretilla","V","No Manner",1,1,0,0,0,0
"60","L2","Manner",8,"pge_tabmai","Popi ha empujado una mesa entrando en el garaje","Adjunct","V",1,0,1,1,1,0
"60","L2","Manner",9,"tgd_malnei","Popi arrastra un baúl por una colina nevada","No Path","V",0,0,0,1,1,0
"60","L2","Manner",10,"prt_rourue","Popi rueda una rueda de un vehículo antiguo cruzando una calle","Adjunct","V",1,0,1,1,1,0
"60","L2","Manner",11,"tgd_malcol","Popi ha bajado una colina arrastrando un baúl","V","Adjunct",1,1,0,1,0,1
"60","L2","Manner",12,"tre_cadgro","Popi ha arrastrado una bolsa de compras con ruedas entrando en una cueva","Adjunct","V",1,0,1,1,1,0
"60","L2","Manner",13,"pgt_panrue","Popi ha cruzado una calle con una cesta llena de manzanas","V","No Manner",1,1,0,0,0,0
"60","L2","Manner",14,"tge_chagro","Popi acaba de arrastrar una silla de plástico entrando en una cueva","Adjunct","V",1,0,1,1,1,0
"60","L2","Manner",15,"trt_pourou","Popi ha cruzado el camino con un carro de bebé","V","No Manner",1,1,0,0,0,0
"60","L2","Manner",17,"tgt_cherue","Popi ha cruzado el camino arrastrando un caballo juguete","V","Adjunct",1,1,0,1,0,1
"60","L2","Manner",18,"pgm_paqdun","Popi ha subido una duna empujando un paquete","V","Adjunct",1,1,0,1,0,1
"60","L2","Manner",19,"prd_balcol","Popi ha rodado una pelota inflable bajando una colina","Adjunct","V",1,0,1,1,1,0
"60","L2","Manner",20,"tge_chamai","Popi ha arrastrado una silla de plástico y ha entrado en el garaje","V","V",1,1,0,1,1,0
"60","L2","Manner",21,"prm_boudun","Popi ha rodado un flotador subiendo una duna","Adjunct","V",1,0,1,1,1,0
"60","L2","Manner",22,"trd_bronei","Popi ha bajado una colina nevada con una carretilla","V","No Manner",1,1,0,0,0,0
"60","L2","Manner",23,"pge_tabgro","Popi empuja una mesa y entra en la cueva","V","V",1,1,0,1,1,0
"60","L2","Manner",24,"trm_voitoi","Popi tira de un coche juguete subiendo el tejado","Adjunct","V",1,0,1,1,1,0
"60","L2","Manner",25,"prd_balnei","Popi ha rodado una bola bajando por una colina nevada","Adjunct","V",1,0,1,1,1,0
"60","L2","Manner",26,"pgt_panrou","Popi ha cruzado el camino con una cesta llena de manzanas","V","No Manner",1,1,0,0,0,0
"60","L2","Manner",27,"tre_cadmai","Popi ha tirado de una carretilla y ha entrado en el garaje","V","V",1,1,0,1,1,0
"60","L2","Manner",28,"prm_boutoi","Popi ha rodado un flotador hasta la punta de un tejado","Adjunct","V",1,0,1,1,1,0
"60","L2","Manner",29,"trt_pourue","Popi ha cruzado la calle tirando un carrito de bebé","V","Adjunct",1,1,0,1,0,1
"60","L2","Manner",30,"pre_pnegro","Popi ha rodado una rueda y ha entrado con la rueda en la cueva","V","V",1,1,0,1,1,0
"60","L2","Manner",31,"trm_voidun","Popi ha subido una duna tirando un coche juguete","V","Adjunct",1,1,0,1,0,1
"60","L2","Manner",32,"pgd_valcol","Popi ha empujado una maleta por una colina","No Path","V",0,0,0,1,1,0
"NS_1","NS","Control",1,"trd_brocol","ha bajado la ladera de una colina con una carretilla a su espalda","V","Adjunct",1,1,0,1,0,1
"NS_1","NS","Control",2,"tgm_sacdun","ha subido un saco por una duna de la playa","V","No Manner",1,1,0,0,0,0
"NS_1","NS","Control",3,"trd_bronei","ha bajado una ladera con una carretilla a su espalda sobre la nieve","V","Adjunct",1,1,0,1,0,1
"NS_1","NS","Control",4,"pgm_paqdun","ha subido un regalo por una duna en la playa","V","No Manner",1,1,0,0,0,0
"NS_1","NS","Control",5,"prd_balcol","ha bajado una colina empujando una pelota","V","Adjunct",1,1,0,1,0,1
"NS_1","NS","Control",6,"pge_tabgro","ha metido una mesa en una cueva","V","No Manner",1,1,0,0,0,0
"NS_1","NS","Control",7,"tgd_malcol","ha bajado una especie de baúl por una ladera tirando de él con una cuerda","V","Adjunct",1,1,0,1,0,1
"NS_1","NS","Control",8,"trt_pourou","ha cruzado un camino por una especia de bosque tirando de un carrito","V","Adjunct",1,1,0,1,0,1
"NS_1","NS","Control",9,"pgd_valcol","ha bajado por una ladera empujando una maleta","V","Adjunct",1,1,0,1,0,1
"NS_1","NS","Control",10,"trt_pourue","ha cruzado una calle de un pueblo tirando de un carrito de bebé","V","Adjunct",1,1,0,1,0,1
"NS_1","NS","Control",11,"prd_balnei","ha bajado una ladera nevada empujando una pelota","V","Adjunct",1,1,0,1,0,1
"NS_1","NS","Control",12,"pgm_paqtoi","ha subido empujando un regalo por el tejado de una casa","V","Adjunct",1,1,0,1,0,1
"NS_1","NS","Control",13,"tgt_cherou","ha cruzado un camino tirando de un caballito de madera","V","Adjunct",1,1,0,1,0,1
"NS_1","NS","Control",14,"prm_boutoi","ha subido un flotador en forma de rosquilla por encima de un tejado","V","No Manner",1,1,0,0,0,0
"NS_1","NS","Control",15,"pgt_panrou","ha cruzado un camino campestre empujando una cesta llena de manzanas","V","Adjunct",1,1,0,1,0,1
"NS_1","NS","Control",16,"trm_voidun","ha subido una duna de una playa tirando de un cochecito de juguete con una cuerda","V","Adjunct",1,1,0,1,0,1
"NS_1","NS","Control",17,"tge_chagro","ha metido una silla verde en una cueva","V","No Manner",1,1,0,0,0,0
"NS_1","NS","Control",18,"prt_rourue","ha cruzado un camino de un pueblo empujando una rueda","V","Adjunct",1,1,0,1,0,1
"NS_1","NS","Control",19,"tre_cadmai","ha entrado en un pajar tirando de un carretilla","V","Adjunct",1,1,0,1,0,1
"NS_1","NS","Control",20,"prm_boudun","ha subido una duna de la playa empujando un flotador con forma de rosquilla","V","Adjunct",1,1,0,1,0,1
"NS_1","NS","Control",21,"pgt_panrue","ha cruzado la calle de un pueblo empujando una cesta llena de manzanas","V","Adjunct",1,1,0,1,0,1
"NS_1","NS","Control",22,"pre_pnegro","ha entrado en una cueva en el campo empujando una rueda de coche","V","Adjunct",1,1,0,1,0,1
"NS_1","NS","Control",23,"tgm_sactoi","ha subido por el tejado de una casa tirando de un saco","V","Adjunct",1,1,0,1,0,1
"NS_1","NS","Control",24,"pgd_valnei","ha bajado por una ladera nevada empujando una maleta","V","Adjunct",1,1,0,1,0,1
"NS_1","NS","Control",25,"trm_voitoi","ha subido por el tejado de una casa tirando de un cochecito de juguete atado a una cuerda","V","Adjunct",1,1,0,1,0,1
"NS_1","NS","Control",26,"pre_pnemai","ha entrado en un granero empujando una rueda de coche","V","Adjunct",1,1,0,1,0,1
"NS_1","NS","Control",27,"tgt_cherue","ha cruzado una calle de un pueblo tirando de un caballito de madera atado a una cuerda","V","Adjunct",1,1,0,1,0,1
"NS_1","NS","Control",28,"pge_tabmai","ha entrado en un establo empujando una mesa de madera","V","Adjunct",1,1,0,1,0,1
"NS_1","NS","Control",29,"tgd_malnei","ha bajado una ladera nevada tirando de un baúl atado a una cuerda","V","Adjunct",1,1,0,1,0,1
"NS_1","NS","Control",30,"tre_cadgro","ha entrado en una cueva en el campo tirando de un carrito de la compra verde","V","Adjunct",1,1,0,1,0,1
"NS_1","NS","Control",31,"prt_rourou","ha cruzado un camino rural empujando una rueda de carruaje","V","Adjunct",1,1,0,1,0,1
"NS_1","NS","Control",32,"tge_chamai","ha entrado en un granero arrastrando una silla verde","V","Adjunct",1,1,0,1,0,1
"NS_150","NS","Manner",1,"tgt_cherou","Popi arrastra un caballito de juguete","No Path","V",0,0,0,1,1,0
"NS_150","NS","Manner",2,"pgd_valnei","Popi desliza una maleta por la nieve ","No Path","V",0,0,0,1,1,0
"NS_150","NS","Manner",3,"tgm_sactoi","Popi sube un tejado arrastrando un saco","V","Adjunct",1,1,0,1,0,1
"NS_150","NS","Manner",4,"tre_cadgro","Popi entra en una cueva con un carrito ","V","No Manner",1,1,0,0,0,0
"NS_150","NS","Manner",5,"prt_rourou","Popi lleva una rueda de un lado a otro de la carretera","Adjunct","No Manner",1,0,1,0,0,0
"NS_150","NS","Manner",6,"tgd_malnei","Popi lleva un cajón ladera abajo","Adjunct","No Manner",1,0,1,0,0,0
"NS_150","NS","Manner",7,"trm_voidun","Popi arrastra un cochecito por la arena","No Path","V",0,0,0,1,1,0
"NS_150","NS","Manner",8,"pgt_panrou","Popi empuja una cesta con frutas","No Path","V",0,0,0,1,1,0
"NS_150","NS","Manner",9,"tgd_malcol","Popi arrastra un cajón por el césped","No Path","V",0,0,0,1,1,0
"NS_150","NS","Manner",10,"pgt_panrue","Popi empuja una cesta con frutas por una cuidad","No Path","V",0,0,0,1,1,0
"NS_150","NS","Manner",11,"prd_balcol","Popi rueda una pelota por una colina","No Path","V",0,0,0,1,1,0
"NS_150","NS","Manner",12,"pgm_paqtoi","Popi empuja un regalo por un tejado","No Path","V",0,0,0,1,1,0
"NS_150","NS","Manner",13,"trt_pourue","Popi cruza la calle con un carrito","V","No Manner",1,1,0,0,0,0
"NS_150","NS","Manner",14,"prm_boudun","Popi rueda un flotador por la arena","No Path","V",0,0,0,1,1,0
"NS_150","NS","Manner",15,"tge_chamai","Popi lleva una silla adentro de una casa","Adjunct","No Manner",1,0,1,0,0,0
"NS_150","NS","Manner",16,"trd_bronei","Popi lleva un carro por la nieve","No Path","No Manner",0,0,0,0,0,0
"NS_150","NS","Manner",17,"pre_pnegro","Popi rueda un neumático adentro de una cueva","Adjunct","V",1,0,1,1,1,0
"NS_150","NS","Manner",18,"tgm_sacdun","Popi sube un saco por la arena","V","No Manner",1,1,0,0,0,0
"NS_150","NS","Manner",19,"pge_tabmai","Popi empuja una mesa hacia dentro de una casa","Adjunct","V",1,0,1,1,1,0
"NS_150","NS","Manner",20,"trm_voitoi","Popi tira de un coche hacia arriba de un tejado ","Adjunct","V",1,0,1,1,1,0
"NS_150","NS","Manner",21,"pre_pnemai","Popi empuja una rueda hacia dentro una casa","Adjunct","V",1,0,1,1,1,0
"NS_150","NS","Manner",22,"tgt_cherue","Popi cruza la calle arrastrando un caballito de juguete","V","Adjunct",1,1,0,1,0,1
"NS_150","NS","Manner",23,"tre_cadmai","Popi lleva un carrito hacia dentro una casa","Adjunct","No Manner",1,0,1,0,0,0
"NS_150","NS","Manner",24,"prm_boutoi","Popi rueda un flotator por encima de un tejado","No Path","V",0,0,0,1,1,0
"NS_150","NS","Manner",25,"trt_pourou","Popi cruza la carretera con un carrito ","V","No Manner",1,1,0,0,0,0
"NS_150","NS","Manner",26,"prd_balnei","Popi lleva una pelota colina abajo","Adjunct","No Manner",1,0,1,0,0,0
"NS_150","NS","Manner",27,"pgm_paqdun","Popi empuja un regalo por la arena","No Path","V",0,0,0,1,1,0
"NS_150","NS","Manner",28,"trd_brocol","Popi lleva un carrito ladera abajo","Adjunct","No Manner",1,0,1,0,0,0
"NS_150","NS","Manner",29,"pge_tabgro","Popi lleva una mesa adentro de una cueva","Adjunct","No Manner",1,0,1,0,0,0
"NS_150","NS","Manner",30,"prt_rourue","Popi lleva una rueda de un lado a otro de la calle","Adjunct","No Manner",1,0,1,0,0,0
"NS_150","NS","Manner",31,"pgd_valcol","Popi arrastra una maleta por el campo","No Path","V",0,0,0,1,1,0
"NS_150","NS","Manner",32,"prt_rourou","Popi cruza la carretera con una rueda","V","No Manner",1,1,0,0,0,0
"NS_151","NS","Control",1,"tgm_sacdun","Popi arrastra un saco por la playa","No Path","V",0,0,0,1,1,0
"NS_151","NS","Control",2,"pge_tabmai","Popi empuja una mesa de madera","No Path","V",0,0,0,1,1,0
"NS_151","NS","Control",3,"tgm_sactoi","Popi lleva consigo una bolsa","No Path","No Manner",0,0,0,0,0,0
"NS_151","NS","Control",4,"pge_tabgro","Popi arrastra consigo la mesa en otro lugar","No Path","V",0,0,0,1,1,0
"NS_151","NS","Control",5,"tgd_malcol","Popi mueve arrastrando una caja","No Path","Adjunct",0,0,0,1,0,1
"NS_151","NS","Control",6,"prt_rourou","Popi mueve una rueda","No Path","No Manner",0,0,0,0,0,0
"NS_151","NS","Control",7,"tre_cadgro","Popi arrastra un carrito de la compra","No Path","V",0,0,0,1,1,0
"NS_151","NS","Control",8,"pgm_paqtoi","Popi arrastra un regalo muy grande por encima de la casa","No Path","V",0,0,0,1,1,0
"NS_151","NS","Control",9,"tgt_cherou","Popi arrastra un juguete de un caballito","No Path","V",0,0,0,1,1,0
"NS_151","NS","Control",10,"pre_pnemai","Popi empuja o mueve una rueda","No Path","V",0,0,0,1,1,0
"NS_151","NS","Control",11,"pgt_panrou","Popi arrastra un cesto de frutas","No Path","V",0,0,0,1,1,0
"NS_151","NS","Control",12,"prm_boutoi","Popi sube un flotador","V","No Manner",1,1,0,0,0,0
"NS_151","NS","Control",13,"pgd_valcol","Popi arrastra colina abajo una maleta","Adjunct","V",1,0,1,1,1,0
"NS_151","NS","Control",14,"trt_pourue","Popi tira de un carrito de bebé","No Path","V",0,0,0,1,1,0
"NS_151","NS","Control",15,"tge_chagro","Popi arrastra una silla","No Path","V",0,0,0,1,1,0
"NS_151","NS","Control",16,"prt_rourue","Popi arrastra la rueda de antes","No Path","V",0,0,0,1,1,0
"NS_151","NS","Control",17,"tre_cadmai","Popi se introduce con el carrito de la compra dentro de un garaje","V+Adjunct","No Manner",1,1,1,0,0,0
"NS_151","NS","Control",18,"pgd_valnei","Popi persiste arrastrando la maleta","No Path","Adjunct",0,0,0,1,0,1
"NS_151","NS","Control",19,"pre_pnegro","Popi arrastra una rueda de camión ","No Path","V",0,0,0,1,1,0
"NS_151","NS","Control",20,"trd_bronei","Popi va colina abajo con una carretilla","Adjunct","No Manner",1,0,1,0,0,0
"NS_151","NS","Control",21,"prm_boudun","Popi asciende con el flotador","V","No Manner",1,1,0,0,0,0
"NS_151","NS","Control",22,"pgt_panrue","Popi mueve la cesta de frutas hacia la izquierda","No Path","No Manner",0,0,0,0,0,0
"NS_151","NS","Control",23,"tgd_malnei","Popi desciende arrastrando la caja","V","Adjunct",1,1,0,1,0,1
"NS_151","NS","Control",24,"pgm_paqdun","Popi empuja el regalo por colina arriba","Adjunct","V",1,0,1,1,1,0
"NS_151","NS","Control",25,"trt_pourou","Popi tira del carrito","No Path","V",0,0,0,1,1,0
"NS_151","NS","Control",26,"prd_balnei","Popi empuja un gran balón","No Path","V",0,0,0,1,1,0
"NS_151","NS","Control",27,"trm_voidun","Popi arrastra consigo un coche de juguete","No Path","V",0,0,0,1,1,0
"NS_151","NS","Control",28,"tge_chamai","Popi arrastra una silla","No Path","V",0,0,0,1,1,0
"NS_151","NS","Control",29,"trm_voitoi","Popi empuja consigo un coche de juguete","No Path","V",0,0,0,1,1,0
"NS_151","NS","Control",30,"tgt_cherue","Popi arrastra un caballito de juguete","No Path","V",0,0,0,1,1,0
"NS_151","NS","Control",31,"trd_brocol","Popi desciende arrastrando una carretilla","V","Adjunct",1,1,0,1,0,1
"NS_151","NS","Control",32,"pgt_panrou","Popi empuja el cesto de frutas","No Path","V",0,0,0,1,1,0
"NS_152","NS","Control",1,"trt_pourue","Popi está arrastrando un carrito","No Path","V",0,0,0,1,1,0
"NS_152","NS","Control",2,"tge_chagro","Popi está arrastrando una silla","No Path","V",0,0,0,1,1,0
"NS_152","NS","Control",3,"prd_balnei","Popi está arrastrando un balón por la nieve","No Path","V",0,0,0,1,1,0
"NS_152","NS","Control",4,"tgt_cherou","Popi está arrastrando un caballito de madera a través de una carretera ","Adjunct","V",1,0,1,1,1,0
"NS_152","NS","Control",5,"tre_cadmai","Popi está arrastrando un carrito de la compra y se mete por una puerta","V","V",1,1,0,1,1,0
"NS_152","NS","Control",6,"tgd_malnei","Popi arrastra un baúl por una montaña nevada","No Path","V",0,0,0,1,1,0
"NS_152","NS","Control",7,"pgm_paqdun","Popi sube un regalo por una montaña","V","No Manner",1,1,0,0,0,0
"NS_152","NS","Control",8,"pre_pnegro","Popi arrastra una rueda y se mete en una cueva","V","V",1,1,0,1,1,0
"NS_152","NS","Control",9,"tgd_malcol","Popi baja una colina con un baúl","V","No Manner",1,1,0,0,0,0
"NS_152","NS","Control",10,"pgt_panrue","Popi arrastra una cesta con frutas por una carretera","No Path","V",0,0,0,1,1,0
"NS_152","NS","Control",11,"trm_voitoi","Popi sube el tejado de una casa arrastrando un coche","V","Adjunct",1,1,0,1,0,1
"NS_152","NS","Control",12,"pgt_panrou","Popi arrastra un cesto de frutas y pasa una carretera","No Path","V",0,0,0,1,1,0
"NS_152","NS","Control",13,"trd_bronei","Popi baja una montaña arrastrando una carretilla","V","Adjunct",1,1,0,1,0,1
"NS_152","NS","Control",14,"tgm_sactoi","Popi sube un tejado arrastrando un saco","V","Adjunct",1,1,0,1,0,1
"NS_152","NS","Control",15,"prt_rourou","Popi arrastra una rueda pasando por una carretera","No Path","V",0,0,0,1,1,0
"NS_152","NS","Control",16,"tre_cadgro","Popi lleva un carrito verde y entra en una cueva","V","No Manner",1,1,0,0,0,0
"NS_152","NS","Control",17,"pgd_valcol","Popi baja por una montaña arrastrando una maleta","V","Adjunct",1,1,0,1,0,1
"NS_152","NS","Control",18,"trt_pourou","Popi cruzó una carretera llevando un carro","V","No Manner",1,1,0,0,0,0
"NS_152","NS","Control",19,"pge_tabgro","Popi arrastra una mesa y se mete en una cueva","V","V",1,1,0,1,1,0
"NS_152","NS","Control",20,"prm_boudun","Popi sube una montaña arrastrando un flotador","V","Adjunct",1,1,0,1,0,1
"NS_152","NS","Control",21,"trd_brocol","Popi baja una montaña arrastrando una carretilla","V","Adjunct",1,1,0,1,0,1
"NS_152","NS","Control",22,"tgm_sacdun","Popi sube una montaña arrastrando un saco","V","Adjunct",1,1,0,1,0,1
"NS_152","NS","Control",23,"prt_rourue","Popi pasa por una carretera arrastrando una rueda","No Path","Adjunct",0,0,0,1,0,1
"NS_152","NS","Control",24,"pgm_paqtoi","Popi sube un tejado arrastrando un regalo","V","Adjunct",1,1,0,1,0,1
"NS_152","NS","Control",25,"tge_chamai","Popi se mete en una casa arrastrando una silla","V","Adjunct",1,1,0,1,0,1
"NS_152","NS","Control",26,"pgd_valnei","Popi baja una montaña nevada arrastrando una maleta","V","Adjunct",1,1,0,1,0,1
"NS_152","NS","Control",27,"pre_pnemai","Popi se mete por una puerta arrastrando una rueda","V","Adjunct",1,1,0,1,0,1
"NS_152","NS","Control",28,"tgt_cherue","Popi cruza una carretera arrastrando un caballito de madera","V","Adjunct",1,1,0,1,0,1
"NS_152","NS","Control",29,"trm_voidun","Popi sube una montaña arrastrando un cochecito","V","Adjunct",1,1,0,1,0,1
"NS_152","NS","Control",30,"pge_tabmai","Popi arrastra una mesa y se mete por una puerta","V","V",1,1,0,1,1,0
"NS_152","NS","Control",31,"prd_balcol","Popi baja una colina arrastrando una pelota","V","Adjunct",1,1,0,1,0,1
"NS_152","NS","Control",32,"pgm_paqtoi","Popi sube un tejado arrastrando un regalo","V","Adjunct",1,1,0,1,0,1
"NS_153","NS","Control",1,"prd_balcol","Popi ha estado empujando una bola y bajando [ha estado bajando] la cuesta","V","V",1,1,0,1,1,0
"NS_153","NS","Control",2,"trm_voidun","Popi ha estado subiendo la cuesta de arena con un coche","V","No Manner",1,1,0,0,0,0
"NS_153","NS","Control",3,"prt_rourou","Popi ha cruzado el río con una rueda","V","No Manner",1,1,0,0,0,0
"NS_153","NS","Control",4,"tre_cadgro","Popi va con su carro de la compra y ha pasado la cueva","No Path","No Manner",0,0,0,0,0,0
"NS_153","NS","Control",5,"tgd_malnei","Popi ha bajado la nieve a cuestas con una caja","V","Adjunct",1,1,0,1,0,1
"NS_153","NS","Control",6,"pge_tabgro","Popi va empujando una mesa y ha entrado con ella por la cueva","V","Adjunct",1,1,0,1,0,1
"NS_153","NS","Control",7,"prt_rourue","Popi ha cruzado la calle con la rueda","V","No Manner",1,1,0,0,0,0
"NS_153","NS","Control",8,"pgd_valnei","Popi ha bajado la nieve arrastrando una maleta grande","V","Adjunct",1,1,0,1,0,1
"NS_153","NS","Control",9,"trt_pourue","Popi ha cruzado la calle con un coche de bebé","V","No Manner",1,1,0,0,0,0
"NS_153","NS","Control",10,"tgm_sacdun","Popi ha subido la duna con un saco grande","V","No Manner",1,1,0,0,0,0
"NS_153","NS","Control",11,"pgt_panrue","Popi ha cruzado la calle empujando una caja con manzanas","V","Adjunct",1,1,0,1,0,1
"NS_153","NS","Control",12,"tgm_sactoi","Popi ha subido hasta el tejado a cuestas con un saco","V","Adjunct",1,1,0,1,0,1
"NS_153","NS","Control",13,"prd_balnei","Popi ha bajado en la nieve con una pelota grande de colores morado verde y amarillo ","V","No Manner",1,1,0,0,0,0
"NS_153","NS","Control",14,"tgt_cherue","Popi ha cruzado la calle con un caballo de juguete de color marrón verde y rojo","V","No Manner",1,1,0,0,0,0
"NS_153","NS","Control",15,"pgm_paqdun","Popi ha subido la duna a cuestas de un regalo con un lazo amarillo y la caja morada","V","Adjunct",1,1,0,1,0,1
"NS_153","NS","Control",16,"trt_pourou","Popi ha cruzado el río hasta la izquierda con el carrito de bebé de color morado","V","No Manner",1,1,0,0,0,0
"NS_153","NS","Control",17,"tgd_malcol","Popi ha bajado la cuesta del campo con un cofre grande","V","No Manner",1,1,0,0,0,0
"NS_153","NS","Control",18,"prm_boutoi","Popi ha subido al tejado de la casa en el campo con un flotador naranja","V","No Manner",1,1,0,0,0,0
"NS_153","NS","Control",19,"tre_cadmai","Popi ha entrado a la casa con el carro de la compra que tiene el color verde","V","No Manner",1,1,0,0,0,0
"NS_153","NS","Control",20,"pgt_panrou","Popi ha cruzado el río mientras arrastraba la caja con muchas manzanas","V","Adjunct",1,1,0,1,0,1
"NS_153","NS","Control",21,"pre_pnegro","Popi ha entrado en la cueva arrastrando una rueda de un coche","V","Adjunct",1,1,0,1,0,1
"NS_153","NS","Control",22,"trd_bronei","Popi ha bajado la nieve a cuestas con una carretilla de color amarillo","V","Adjunct",1,1,0,1,0,1
"NS_153","NS","Control",23,"pgm_paqtoi","Popi ha subido al tejado de la casa a cuestas con la caja de regalo con el lazo amarillo","V","Adjunct",1,1,0,1,0,1
"NS_153","NS","Control",24,"tge_chamai","Popi entra en la casa mientras arrastraba una silla de plástico del color verde","V","Adjunct",1,1,0,1,0,1
"NS_153","NS","Control",25,"prm_boudun","Popi ha subido la duna con un flotador naranja con delfines","V","No Manner",1,1,0,0,0,0
"NS_153","NS","Control",26,"pgd_valcol","Popi bajaba el campo acompañado de una maleta grande de color azul oscuro","V","No Manner",1,1,0,0,0,0
"NS_153","NS","Control",27,"tgt_cherou","Popi ha cruzado el río junto al caballito de juguete","V","No Manner",1,1,0,0,0,0
"NS_153","NS","Control",28,"pge_tabmai","Popi entraba en la casa para meter la mesa de madero","V+Adjunct","No Manner",1,1,1,0,0,0
"NS_153","NS","Control",29,"trm_voitoi","Popi ha subido al tejado a cuestas con el cochecito de juguete","V","Adjunct",1,1,0,1,0,1
"NS_153","NS","Control",30,"tge_chagro","Popi ha entrado en la cueva con la silla de plástico de color verde","V","No Manner",1,1,0,0,0,0
"NS_153","NS","Control",31,"trd_brocol","Popi ha bajado la cuesta del campo con una carretilla de color amarillo","V","No Manner",1,1,0,0,0,0
"NS_153","NS","Control",32,"pgm_paqtoi","Popi ha subido al tejado de la casa con el regalo ","V","No Manner",1,1,0,0,0,0
"NS_154","NS","Control",1,"trm_voidun","Popi empujando un coche de juguete por una duna de arena en el mar","No Path","Adjunct",0,0,0,1,0,1
"NS_154","NS","Control",2,"pge_tabmai","Popi empuja una mesa hacia una casa ","No Path","V",0,0,0,1,1,0
"NS_154","NS","Control",3,"trm_voitoi","Popi empuja el coche por un tejado de una casa en la montaña","No Path","V",0,0,0,1,1,0
"NS_154","NS","Control",4,"prt_rourue","Popi empuja por una calle el rodamiento de un antiguo carruaje","No Path","V",0,0,0,1,1,0
"NS_154","NS","Control",5,"tge_chamai","Popi empuja una silla hacia las puertas de una casa","No Path","V",0,0,0,1,1,0
"NS_154","NS","Control",6,"trd_brocol","Popi baja una carretilla por una ladera","V","No Manner",1,1,0,0,0,0
"NS_154","NS","Control",7,"pge_tabgro","Popi empujó una mesa hacia una cueva","No Path","V",0,0,0,1,1,0
"NS_154","NS","Control",8,"tgd_malcol","Popi baja un baúl por una ladera","V","No Manner",1,1,0,0,0,0
"NS_154","NS","Control",9,"trt_pourou","Popi cruza una carretera con un carrito de bebé","V","No Manner",1,1,0,0,0,0
"NS_154","NS","Control",10,"tge_chagro","Popi arrastra una silla hacia dentro en una cueva","Adjunct","V",1,0,1,1,1,0
"NS_154","NS","Control",11,"pgd_valcol","Popi empuja una maleta bajando una ladera","Adjunct","V",1,0,1,1,1,0
"NS_154","NS","Control",12,"prm_boudun","Popi está subiendo por la arena de la playa un flotador","V","No Manner",1,1,0,0,0,0
